### ISSUE TITLE
ungraceful tcp teardown by paramiko client

### ISSUE THREAD

**Issue by sebbov** [paramiko/paramiko#884]
We've noticed received frequent connection resets from paramiko ssh clients in a port forwarding application (sitting between a tcp client and tcp server).

The following reproduces it in a smaller setting, and shows that a race may be going on as injecting a short sleep helps:

osboxes@osboxes:~$ cat tmp/paramiko_reset_repro.py
#!/usr/bin/env python
import paramiko
import sys
import time

print paramiko.__path__

client = paramiko.SSHClient()
client.set_missing_host_key_policy(paramiko.AutoAddPolicy())
client.connect('127.0.0.1')
client.exec_command('hostname')
if len(sys.argv) > 1:
  time.sleep(float(sys.argv[1]))
client.close()

osboxes@osboxes:~$ nc localhost 22 < /dev/null  # Seen with busybox and more recent openssh versions as well though.
SSH-2.0-OpenSSH_6.9p1 Ubuntu-2ubuntu0.2

osboxes@osboxes:~$ sudo tcpdump -i lo -n 'port 22 and tcp[tcpflags] & (tcp-rst) != 0' &
[1] 5492
osboxes@osboxes:~$ tcpdump: verbose output suppressed, use -v or -vv for full protocol decode
listening on lo, link-type EN10MB (Ethernet), capture size 262144 bytes

osboxes@osboxes:~$ for i in $(seq 20) ; do tmp/paramiko_reset_repro.py ; done
['/usr/local/lib/python2.7/dist-packages/paramiko']
20:09:10.749237 IP 127.0.0.1.34216 > 127.0.0.1.22: Flags [R.], seq 1276565317, ack 2338355021, win 387, options [nop,nop,TS val 27888121 ecr 27888118], length 0
['/usr/local/lib/python2.7/dist-packages/paramiko']
['/usr/local/lib/python2.7/dist-packages/paramiko']
['/usr/local/lib/python2.7/dist-packages/paramiko']
20:09:13.255283 IP 127.0.0.1.34222 > 127.0.0.1.22: Flags [R.], seq 1398858161, ack 3022618388, win 387, options [nop,nop,TS val 27888747 ecr 27888746], length 0
['/usr/local/lib/python2.7/dist-packages/paramiko']
20:09:14.238715 IP 127.0.0.1.34224 > 127.0.0.1.22: Flags [R.], seq 3258683825, ack 3769987200, win 402, options [nop,nop,TS val 27888993 ecr 27888992], length 0
['/usr/local/lib/python2.7/dist-packages/paramiko']
['/usr/local/lib/python2.7/dist-packages/paramiko']
20:09:15.896182 IP 127.0.0.1.34228 > 127.0.0.1.22: Flags [R.], seq 3232465230, ack 3374722881, win 387, options [nop,nop,TS val 27889408 ecr 27889407], length 0
['/usr/local/lib/python2.7/dist-packages/paramiko']
20:09:16.710964 IP 127.0.0.1.34230 > 127.0.0.1.22: Flags [R.], seq 1745050315, ack 2277778414, win 387, options [nop,nop,TS val 27889611 ecr 27889610], length 0
['/usr/local/lib/python2.7/dist-packages/paramiko']
20:09:17.515591 IP 127.0.0.1.34232 > 127.0.0.1.22: Flags [R.], seq 87355496, ack 3731902908, win 387, options [nop,nop,TS val 27889812 ecr 27889812], length 0
['/usr/local/lib/python2.7/dist-packages/paramiko']
20:09:18.277479 IP 127.0.0.1.34234 > 127.0.0.1.22: Flags [R.], seq 3254875312, ack 3384849141, win 387, options [nop,nop,TS val 27890003 ecr 27890002], length 0
['/usr/local/lib/python2.7/dist-packages/paramiko']
20:09:19.068218 IP 127.0.0.1.34236 > 127.0.0.1.22: Flags [R.], seq 3427769392, ack 4201542259, win 387, options [nop,nop,TS val 27890200 ecr 27890200], length 0
['/usr/local/lib/python2.7/dist-packages/paramiko']
20:09:19.845450 IP 127.0.0.1.34238 > 127.0.0.1.22: Flags [R.], seq 3160934153, ack 3814780789, win 387, options [nop,nop,TS val 27890395 ecr 27890394], length 0
['/usr/local/lib/python2.7/dist-packages/paramiko']
20:09:20.596868 IP 127.0.0.1.34240 > 127.0.0.1.22: Flags [R.], seq 2406079621, ack 3049901745, win 387, options [nop,nop,TS val 27890583 ecr 27890582], length 0
['/usr/local/lib/python2.7/dist-packages/paramiko']
20:09:21.357401 IP 127.0.0.1.34242 > 127.0.0.1.22: Flags [R.], seq 3306373976, ack 419084605, win 387, options [nop,nop,TS val 27890773 ecr 27890772], length 0
['/usr/local/lib/python2.7/dist-packages/paramiko']
20:09:22.208139 IP 127.0.0.1.34244 > 127.0.0.1.22: Flags [R.], seq 3656803648, ack 2130657397, win 387, options [nop,nop,TS val 27890986 ecr 27890984], length 0
['/usr/local/lib/python2.7/dist-packages/paramiko']
['/usr/local/lib/python2.7/dist-packages/paramiko']
['/usr/local/lib/python2.7/dist-packages/paramiko']
['/usr/local/lib/python2.7/dist-packages/paramiko']
20:09:25.572263 IP 127.0.0.1.34252 > 127.0.0.1.22: Flags [R.], seq 618288828, ack 3611108403, win 387, options [nop,nop,TS val 27891827 ecr 27891826], length 0
['/usr/local/lib/python2.7/dist-packages/paramiko']
osboxes@osboxes:~$

osboxes@osboxes:~$ for i in $(seq 20) ; do tmp/paramiko_reset_repro.py 1 ; done
['/usr/local/lib/python2.7/dist-packages/paramiko']
['/usr/local/lib/python2.7/dist-packages/paramiko']
['/usr/local/lib/python2.7/dist-packages/paramiko']
['/usr/local/lib/python2.7/dist-packages/paramiko']
['/usr/local/lib/python2.7/dist-packages/paramiko']
['/usr/local/lib/python2.7/dist-packages/paramiko']
['/usr/local/lib/python2.7/dist-packages/paramiko']
['/usr/local/lib/python2.7/dist-packages/paramiko']
['/usr/local/lib/python2.7/dist-packages/paramiko']
['/usr/local/lib/python2.7/dist-packages/paramiko']
['/usr/local/lib/python2.7/dist-packages/paramiko']
['/usr/local/lib/python2.7/dist-packages/paramiko']
['/usr/local/lib/python2.7/dist-packages/paramiko']
['/usr/local/lib/python2.7/dist-packages/paramiko']
['/usr/local/lib/python2.7/dist-packages/paramiko']
['/usr/local/lib/python2.7/dist-packages/paramiko']
['/usr/local/lib/python2.7/dist-packages/paramiko']
['/usr/local/lib/python2.7/dist-packages/paramiko']
['/usr/local/lib/python2.7/dist-packages/paramiko']
['/usr/local/lib/python2.7/dist-packages/paramiko']
osboxes@osboxes:~$

osboxes@osboxes:~$ cat /usr/local/lib/python2.7/dist-packages/paramiko/_version.py
__version_info__ = (2, 1, 1)
__version__ = '.'.join(map(str, __version_info__))

fyi - A possible cause for the reset is that the receive buffer isn't fully drained on socket close().   I indeed didn't see this issue when i injected some socket.recv()'s prior to the socket.close() in the paramiko client code.
